{
  "prompts": [
    {
      "domain": "sokoban",
      "problem": "(define (problem sokoban)\n\t(:domain sokoban)\n\t(:objects sokoban crate1 crate2 l10 l11 l12 l19 l20 l21 l22 l29 l30 l31 l40 l41 l42 l43 l48 l49 l50 l52 l57 l58 l59 l60 l61)\n\t(:init (sokoban sokoban)\n\t\t(crate crate1)\n\t\t(crate crate2)\n\t\t(leftOf l10 l11)\n\t\t(leftOf l11 l12)\n\t\t(leftOf l19 l20)\n\t\t(leftOf l20 l21)\n\t\t(leftOf l21 l22)\n\t\t(leftOf l29 l30)\n\t\t(leftOf l30 l31)\n\t\t(leftOf l40 l41)\n\t\t(leftOf l41 l42)\n\t\t(leftOf l42 l43)\n\t\t(leftOf l48 l49)\n\t\t(leftOf l49 l50)\n\t\t(leftOf l57 l58)\n\t\t(leftOf l58 l59)\n\t\t(leftOf l59 l60)\n\t\t(leftOf l60 l61)\n\t\t(below l19 l10)\n\t\t(below l20 l11)\n\t\t(below l21 l12)\n\t\t(below l29 l20)\n\t\t(below l30 l21)\n\t\t(below l31 l22)\n\t\t(below l40 l31)\n\t\t(below l49 l40)\n\t\t(below l50 l41)\n\t\t(below l52 l43)\n\t\t(below l57 l48)\n\t\t(below l58 l49)\n\t\t(below l59 l50)\n\t\t(below l61 l52)\n\t\t(at sokoban l40)\n\t\t(at crate1 l20)\n\t\t(at crate2 l30)\n\t\t(clear l10)\n\t\t(clear l11)\n\t\t(clear l12)\n\t\t(clear l19)\n\t\t(clear l21)\n\t\t(clear l22)\n\t\t(clear l29)\n\t\t(clear l31)\n\t\t(clear l41)\n\t\t(clear l42)\n\t\t(clear l43)\n\t\t(clear l48)\n\t\t(clear l49)\n\t\t(clear l50)\n\t\t(clear l52)\n\t\t(clear l57)\n\t\t(clear l58)\n\t\t(clear l59)\n\t\t(clear l60)\n\t\t(clear l61)\n\t)\n\t(:goal (and\n\t\t(or (at crate1 l41) (at crate2 l41) )\n\t\t(or (at crate1 l50) (at crate2 l50) )\n\t))\n)",
      "solution": "(moveup sokoban l40 l31)\n(moveup sokoban l31 l22)\n(moveleft sokoban l22 l21)\n(moveup sokoban l21 l12)\n(moveleft sokoban l12 l11)\n(moveleft sokoban l11 l10)\n(movedown sokoban l10 l19)\n(pushright sokoban l19 l20 l21 crate1)\n(movedown sokoban l20 l29)\n(pushright sokoban l29 l30 l31 crate2)\n(moveleft sokoban l30 l29)\n(moveup sokoban l29 l20)\n(moveup sokoban l20 l11)\n(moveright sokoban l11 l12)\n(pushdown sokoban l12 l21 l30 crate1)\n(moveright sokoban l21 l22)\n(pushdown sokoban l22 l31 l40 crate2)\n(pushdown sokoban l31 l40 l49 crate2)\n(moveright sokoban l40 l41)\n(movedown sokoban l41 l50)\n(movedown sokoban l50 l59)\n(moveleft sokoban l59 l58)\n(moveleft sokoban l58 l57)\n(moveup sokoban l57 l48)\n(pushright sokoban l48 l49 l50 crate2)\n(moveup sokoban l49 l40)\n(moveup sokoban l40 l31)\n(moveup sokoban l31 l22)\n(moveleft sokoban l22 l21)\n(moveleft sokoban l21 l20)\n(movedown sokoban l20 l29)\n(pushright sokoban l29 l30 l31 crate1)\n(moveup sokoban l30 l21)\n(moveright sokoban l21 l22)\n(pushdown sokoban l22 l31 l40 crate1)\n(pushdown sokoban l31 l40 l49 crate1)\n(moveright sokoban l40 l41)\n(moveright sokoban l41 l42)\n(moveright sokoban l42 l43)\n(movedown sokoban l43 l52)\n(movedown sokoban l52 l61)\n(moveleft sokoban l61 l60)\n(moveleft sokoban l60 l59)\n(pushup sokoban l59 l50 l41 crate2)\n(movedown sokoban l50 l59)\n(moveleft sokoban l59 l58)\n(moveleft sokoban l58 l57)\n(moveup sokoban l57 l48)\n(pushright sokoban l48 l49 l50 crate1)",
      "prompt_actions": {
        "Prompt 2": "moveup sokoban l40 l31",
        "Prompt 3": "pushright sokoban l48 l49 l50 crate1",
        "Prompt 4a": "pushdown sokoban l12 l21 l30 crate1",
        "Prompt 4b": "moveleft sokoban l41 l40",
        "Prompt 4c-1": "pushup sokoban l59 l50 l41 crate2",
        "Prompt 4c-2": "pushdown sokoban l59 l50 l41 crate2",
        "Prompt 5": "moveleft sokoban l40 l41"
      }
    },
    {
      "domain": "sokoban",
      "problem": "(define (problem sokoban)\n\t(:domain sokoban)\n\t(:objects sokoban crate1 crate2 l1 l10 l11 l12 l17 l18 l19 l22 l23 l24 l29 l30 l31 l32 l33 l36 l37 l38 l39 l40)\n\t(:init (sokoban sokoban)\n\t\t(crate crate1)\n\t\t(crate crate2)\n\t\t(leftOf l10 l11)\n\t\t(leftOf l11 l12)\n\t\t(leftOf l17 l18)\n\t\t(leftOf l18 l19)\n\t\t(leftOf l22 l23)\n\t\t(leftOf l23 l24)\n\t\t(leftOf l29 l30)\n\t\t(leftOf l30 l31)\n\t\t(leftOf l31 l32)\n\t\t(leftOf l32 l33)\n\t\t(leftOf l36 l37)\n\t\t(leftOf l37 l38)\n\t\t(leftOf l38 l39)\n\t\t(leftOf l39 l40)\n\t\t(below l17 l10)\n\t\t(below l18 l11)\n\t\t(below l19 l12)\n\t\t(below l24 l17)\n\t\t(below l29 l22)\n\t\t(below l30 l23)\n\t\t(below l31 l24)\n\t\t(below l36 l29)\n\t\t(below l37 l30)\n\t\t(below l38 l31)\n\t\t(below l39 l32)\n\t\t(below l40 l33)\n\t\t(at sokoban l19)\n\t\t(at crate1 l17)\n\t\t(at crate2 l18)\n\t\t(clear l1)\n\t\t(clear l10)\n\t\t(clear l11)\n\t\t(clear l12)\n\t\t(clear l22)\n\t\t(clear l23)\n\t\t(clear l24)\n\t\t(clear l29)\n\t\t(clear l30)\n\t\t(clear l31)\n\t\t(clear l32)\n\t\t(clear l33)\n\t\t(clear l36)\n\t\t(clear l37)\n\t\t(clear l38)\n\t\t(clear l39)\n\t\t(clear l40)\n\t)\n\t(:goal (and\n\t\t(or (at crate1 l37) (at crate2 l37) )\n\t\t(or (at crate1 l39) (at crate2 l39) )\n\t))\n)",
      "solution": "(moveup sokoban l19 l12)\n(moveleft sokoban l12 l11)\n(moveleft sokoban l11 l10)\n(pushdown sokoban l10 l17 l24 crate1)\n(pushdown sokoban l17 l24 l31 crate1)\n(moveleft sokoban l24 l23)\n(movedown sokoban l23 l30)\n(movedown sokoban l30 l37)\n(moveright sokoban l37 l38)\n(moveright sokoban l38 l39)\n(moveup sokoban l39 l32)\n(pushleft sokoban l32 l31 l30 crate1)\n(moveup sokoban l31 l24)\n(moveup sokoban l24 l17)\n(moveup sokoban l17 l10)\n(moveright sokoban l10 l11)\n(moveright sokoban l11 l12)\n(movedown sokoban l12 l19)\n(pushleft sokoban l19 l18 l17 crate2)\n(moveup sokoban l18 l11)\n(moveleft sokoban l11 l10)\n(pushdown sokoban l10 l17 l24 crate2)\n(pushdown sokoban l17 l24 l31 crate2)\n(pushdown sokoban l24 l31 l38 crate2)\n(moveup sokoban l31 l24)\n(moveleft sokoban l24 l23)\n(moveleft sokoban l23 l22)\n(movedown sokoban l22 l29)\n(movedown sokoban l29 l36)\n(moveright sokoban l36 l37)\n(pushright sokoban l37 l38 l39 crate2)\n(moveup sokoban l38 l31)\n(moveup sokoban l31 l24)\n(moveleft sokoban l24 l23)\n(pushdown sokoban l23 l30 l37 crate1)",
      "prompt_actions": {
        "Prompt 2": "moveup sokoban l19 l12",
        "Prompt 3": "pushdown sokoban l23 l30 l37 crate1",
        "Prompt 4a": "moveright sokoban l10 l11",
        "Prompt 4b": "movedown sokoban l10 l17",
        "Prompt 4c-1": "pushleft sokoban l19 l18 l17 crate2",
        "Prompt 4c-2": "pushright sokoban l19 l18 l17 crate2",
        "Prompt 5": "moveleft sokoban l10 l09"
      }
    },
    {
      "domain": "sokoban",
      "problem": "(define (problem sokoban)\n\t(:domain sokoban)\n\t(:objects sokoban crate1 crate2 l10 l11 l12 l15 l17 l19 l22 l23 l24 l25 l26 l29 l30 l31 l8 l9)\n\t(:init (sokoban sokoban)\n\t\t(crate crate1)\n\t\t(crate crate2)\n\t\t(leftOf l8 l9)\n\t\t(leftOf l9 l10)\n\t\t(leftOf l10 l11)\n\t\t(leftOf l11 l12)\n\t\t(leftOf l22 l23)\n\t\t(leftOf l23 l24)\n\t\t(leftOf l24 l25)\n\t\t(leftOf l25 l26)\n\t\t(leftOf l29 l30)\n\t\t(leftOf l30 l31)\n\t\t(below l15 l8)\n\t\t(below l17 l10)\n\t\t(below l19 l12)\n\t\t(below l22 l15)\n\t\t(below l24 l17)\n\t\t(below l26 l19)\n\t\t(below l29 l22)\n\t\t(below l30 l23)\n\t\t(below l31 l24)\n\t\t(at sokoban l26)\n\t\t(at crate1 l24)\n\t\t(at crate2 l25)\n\t\t(clear l8)\n\t\t(clear l9)\n\t\t(clear l10)\n\t\t(clear l11)\n\t\t(clear l12)\n\t\t(clear l15)\n\t\t(clear l17)\n\t\t(clear l19)\n\t\t(clear l22)\n\t\t(clear l23)\n\t\t(clear l29)\n\t\t(clear l30)\n\t\t(clear l31)\n\t)\n\t(:goal (and\n\t\t(or (at crate1 l22) (at crate2 l22) )\n\t\t(or (at crate1 l25) (at crate2 l25) )\n\t))\n)",
      "solution": "(moveup sokoban l26 l19)\n(moveup sokoban l19 l12)\n(moveleft sokoban l12 l11)\n(moveleft sokoban l11 l10)\n(moveleft sokoban l10 l9)\n(moveleft sokoban l9 l8)\n(movedown sokoban l8 l15)\n(movedown sokoban l15 l22)\n(movedown sokoban l22 l29)\n(moveright sokoban l29 l30)\n(moveright sokoban l30 l31)\n(pushup sokoban l31 l24 l17 crate1)\n(moveleft sokoban l24 l23)\n(moveleft sokoban l23 l22)\n(moveup sokoban l22 l15)\n(moveup sokoban l15 l8)\n(moveright sokoban l8 l9)\n(moveright sokoban l9 l10)\n(moveright sokoban l10 l11)\n(moveright sokoban l11 l12)\n(movedown sokoban l12 l19)\n(movedown sokoban l19 l26)\n(pushleft sokoban l26 l25 l24 crate2)\n(pushleft sokoban l25 l24 l23 crate2)\n(pushleft sokoban l24 l23 l22 crate2)\n(moveright sokoban l23 l24)\n(moveright sokoban l24 l25)\n(moveright sokoban l25 l26)\n(moveup sokoban l26 l19)\n(moveup sokoban l19 l12)\n(moveleft sokoban l12 l11)\n(moveleft sokoban l11 l10)\n(pushdown sokoban l10 l17 l24 crate1)\n(moveup sokoban l17 l10)\n(moveright sokoban l10 l11)\n(moveright sokoban l11 l12)\n(movedown sokoban l12 l19)\n(movedown sokoban l19 l26)\n(moveleft sokoban l26 l25)\n(pushleft sokoban l25 l24 l23 crate1)\n(movedown sokoban l24 l31)\n(moveleft sokoban l31 l30)\n(moveleft sokoban l30 l29)\n(pushup sokoban l29 l22 l15 crate2)\n(pushright sokoban l22 l23 l24 crate1)\n(pushright sokoban l23 l24 l25 crate1)\n(moveup sokoban l24 l17)\n(moveup sokoban l17 l10)\n(moveleft sokoban l10 l9)\n(moveleft sokoban l9 l8)\n(pushdown sokoban l8 l15 l22 crate2)",
      "prompt_actions": {
        "Prompt 2": "moveup sokoban l26 l19",
        "Prompt 3": "pushdown sokoban l8 l15 l22 crate2",
        "Prompt 4a": "moveright sokoban l10 l11",
        "Prompt 4b": "moveleft sokoban l25 l24",
        "Prompt 4c-1": "pushleft sokoban l25 l24 l23 crate1",
        "Prompt 4c-2": "pushright sokoban l25 l23 l24 crate1",
        "Prompt 5": "pushup sokoban l31 l24 l17 crate2"
      }
    },
    {
      "domain": "sokoban",
      "problem": "(define (problem sokoban)\n\t(:domain sokoban)\n\t(:objects sokoban crate1 crate2 crate3 l10 l15 l16 l17 l18 l19 l22 l23 l24 l25 l26 l29 l30 l31 l37 l38 l9)\n\t(:init (sokoban sokoban)\n\t\t(crate crate1)\n\t\t(crate crate2)\n\t\t(crate crate3)\n\t\t(leftOf l9 l10)\n\t\t(leftOf l15 l16)\n\t\t(leftOf l16 l17)\n\t\t(leftOf l17 l18)\n\t\t(leftOf l18 l19)\n\t\t(leftOf l22 l23)\n\t\t(leftOf l23 l24)\n\t\t(leftOf l24 l25)\n\t\t(leftOf l25 l26)\n\t\t(leftOf l29 l30)\n\t\t(leftOf l30 l31)\n\t\t(leftOf l37 l38)\n\t\t(below l16 l9)\n\t\t(below l17 l10)\n\t\t(below l22 l15)\n\t\t(below l23 l16)\n\t\t(below l24 l17)\n\t\t(below l25 l18)\n\t\t(below l26 l19)\n\t\t(below l29 l22)\n\t\t(below l30 l23)\n\t\t(below l31 l24)\n\t\t(below l37 l30)\n\t\t(below l38 l31)\n\t\t(at sokoban l26)\n\t\t(at crate1 l23)\n\t\t(at crate2 l24)\n\t\t(at crate3 l25)\n\t\t(clear l9)\n\t\t(clear l10)\n\t\t(clear l15)\n\t\t(clear l16)\n\t\t(clear l17)\n\t\t(clear l18)\n\t\t(clear l19)\n\t\t(clear l22)\n\t\t(clear l29)\n\t\t(clear l30)\n\t\t(clear l31)\n\t\t(clear l37)\n\t\t(clear l38)\n\t)\n\t(:goal (and\n\t\t(or (at crate1 l22) (at crate2 l22) (at crate3 l22) )\n\t\t(or (at crate1 l23) (at crate2 l23) (at crate3 l23) )\n\t\t(or (at crate1 l24) (at crate2 l24) (at crate3 l24) )\n\t))\n)",
      "solution": "(moveup sokoban l26 l19)\n(moveleft sokoban l19 l18)\n(moveleft sokoban l18 l17)\n(pushdown sokoban l17 l24 l31 crate2)\n(moveup sokoban l24 l17)\n(moveleft sokoban l17 l16)\n(moveleft sokoban l16 l15)\n(movedown sokoban l15 l22)\n(movedown sokoban l22 l29)\n(moveright sokoban l29 l30)\n(pushup sokoban l30 l23 l16 crate1)\n(moveright sokoban l23 l24)\n(moveup sokoban l24 l17)\n(moveright sokoban l17 l18)\n(moveright sokoban l18 l19)\n(movedown sokoban l19 l26)\n(pushleft sokoban l26 l25 l24 crate3)\n(pushleft sokoban l25 l24 l23 crate3)\n(pushleft sokoban l24 l23 l22 crate3)\n(movedown sokoban l23 l30)\n(movedown sokoban l30 l37)\n(moveright sokoban l37 l38)\n(pushup sokoban l38 l31 l24 crate2)\n(moveleft sokoban l31 l30)\n(moveup sokoban l30 l23)\n(pushright sokoban l23 l24 l25 crate2)\n(moveup sokoban l24 l17)\n(moveup sokoban l17 l10)\n(moveleft sokoban l10 l9)\n(pushdown sokoban l9 l16 l23 crate1)\n(moveright sokoban l16 l17)\n(moveright sokoban l17 l18)\n(moveright sokoban l18 l19)\n(movedown sokoban l19 l26)\n(pushleft sokoban l26 l25 l24 crate2)",
      "prompt_actions": {
        "Prompt 2": "moveup sokoban l26 l19",
        "Prompt 3": "pushleft sokoban l26 l25 l24 crate2",
        "Prompt 4a": "moveright sokoban l17 l18",
        "Prompt 4b": "movedown sokoban l18 l25",
        "Prompt 4c-1": "pushup sokoban l30 l23 l16 crate1",
        "Prompt 4c-2": "pushup sokoban l29 l22 l15 crate1",
        "Prompt 5": "pushdown sokoban l9 l11 l22 crate1"
      }
    },
    {
      "domain": "sokoban",
      "problem": "(define (problem sokoban)\n\t(:domain sokoban)\n\t(:objects sokoban crate1 crate2 crate3 l10 l11 l12 l14 l15 l16 l19 l20 l21 l22 l23 l24 l25 l29 l33 l37 l38 l39 l40 l41 l42 l43 l46 l47 l48 l50 l51 l52 l60 l61)\n\t(:init (sokoban sokoban)\n\t\t(crate crate1)\n\t\t(crate crate2)\n\t\t(crate crate3)\n\t\t(leftOf l10 l11)\n\t\t(leftOf l11 l12)\n\t\t(leftOf l14 l15)\n\t\t(leftOf l15 l16)\n\t\t(leftOf l19 l20)\n\t\t(leftOf l20 l21)\n\t\t(leftOf l21 l22)\n\t\t(leftOf l22 l23)\n\t\t(leftOf l23 l24)\n\t\t(leftOf l24 l25)\n\t\t(leftOf l37 l38)\n\t\t(leftOf l38 l39)\n\t\t(leftOf l39 l40)\n\t\t(leftOf l40 l41)\n\t\t(leftOf l41 l42)\n\t\t(leftOf l42 l43)\n\t\t(leftOf l46 l47)\n\t\t(leftOf l47 l48)\n\t\t(leftOf l50 l51)\n\t\t(leftOf l51 l52)\n\t\t(leftOf l60 l61)\n\t\t(below l19 l10)\n\t\t(below l20 l11)\n\t\t(below l21 l12)\n\t\t(below l23 l14)\n\t\t(below l24 l15)\n\t\t(below l25 l16)\n\t\t(below l29 l20)\n\t\t(below l33 l24)\n\t\t(below l38 l29)\n\t\t(below l42 l33)\n\t\t(below l46 l37)\n\t\t(below l47 l38)\n\t\t(below l48 l39)\n\t\t(below l50 l41)\n\t\t(below l51 l42)\n\t\t(below l52 l43)\n\t\t(below l60 l51)\n\t\t(below l61 l52)\n\t\t(at sokoban l11)\n\t\t(at crate1 l20)\n\t\t(at crate2 l22)\n\t\t(at crate3 l29)\n\t\t(clear l10)\n\t\t(clear l12)\n\t\t(clear l14)\n\t\t(clear l15)\n\t\t(clear l16)\n\t\t(clear l19)\n\t\t(clear l21)\n\t\t(clear l23)\n\t\t(clear l24)\n\t\t(clear l25)\n\t\t(clear l33)\n\t\t(clear l37)\n\t\t(clear l38)\n\t\t(clear l39)\n\t\t(clear l40)\n\t\t(clear l41)\n\t\t(clear l42)\n\t\t(clear l43)\n\t\t(clear l46)\n\t\t(clear l47)\n\t\t(clear l48)\n\t\t(clear l50)\n\t\t(clear l51)\n\t\t(clear l52)\n\t\t(clear l60)\n\t\t(clear l61)\n\t)\n\t(:goal (and\n\t\t(or (at crate1 l39) (at crate2 l39) (at crate3 l39) )\n\t\t(or (at crate1 l40) (at crate2 l40) (at crate3 l40) )\n\t\t(or (at crate1 l41) (at crate2 l41) (at crate3 l41) )\n\t))\n)",
      "solution": "(moveright sokoban l11 l12)\n(movedown sokoban l12 l21)\n(pushright sokoban l21 l22 l23 crate2)\n(pushright sokoban l22 l23 l24 crate2)\n(moveup sokoban l23 l14)\n(moveright sokoban l14 l15)\n(pushdown sokoban l15 l24 l33 crate2)\n(moveleft sokoban l24 l23)\n(moveleft sokoban l23 l22)\n(moveleft sokoban l22 l21)\n(moveup sokoban l21 l12)\n(moveleft sokoban l12 l11)\n(moveleft sokoban l11 l10)\n(movedown sokoban l10 l19)\n(pushright sokoban l19 l20 l21 crate1)\n(pushdown sokoban l20 l29 l38 crate3)\n(moveup sokoban l29 l20)\n(pushright sokoban l20 l21 l22 crate1)\n(pushright sokoban l21 l22 l23 crate1)\n(pushright sokoban l22 l23 l24 crate1)\n(moveup sokoban l23 l14)\n(moveright sokoban l14 l15)\n(moveright sokoban l15 l16)\n(movedown sokoban l16 l25)\n(pushleft sokoban l25 l24 l23 crate1)\n(pushdown sokoban l24 l33 l42 crate2)\n(pushdown sokoban l33 l42 l51 crate2)\n(moveleft sokoban l42 l41)\n(moveleft sokoban l41 l40)\n(moveleft sokoban l40 l39)\n(movedown sokoban l39 l48)\n(moveleft sokoban l48 l47)\n(moveleft sokoban l47 l46)\n(moveup sokoban l46 l37)\n(pushright sokoban l37 l38 l39 crate3)\n(moveup sokoban l38 l29)\n(moveup sokoban l29 l20)\n(moveright sokoban l20 l21)\n(moveright sokoban l21 l22)\n(pushright sokoban l22 l23 l24 crate1)\n(moveup sokoban l23 l14)\n(moveright sokoban l14 l15)\n(moveright sokoban l15 l16)\n(movedown sokoban l16 l25)\n(pushleft sokoban l25 l24 l23 crate1)\n(movedown sokoban l24 l33)\n(movedown sokoban l33 l42)\n(moveright sokoban l42 l43)\n(movedown sokoban l43 l52)\n(movedown sokoban l52 l61)\n(moveleft sokoban l61 l60)\n(pushup sokoban l60 l51 l42 crate2)\n(moveright sokoban l51 l52)\n(moveup sokoban l52 l43)\n(pushleft sokoban l43 l42 l41 crate2)\n(moveup sokoban l42 l33)\n(moveup sokoban l33 l24)\n(pushleft sokoban l24 l23 l22 crate1)\n(pushleft sokoban l23 l22 l21 crate1)\n(pushleft sokoban l22 l21 l20 crate1)\n(moveup sokoban l21 l12)\n(moveleft sokoban l12 l11)\n(moveleft sokoban l11 l10)\n(movedown sokoban l10 l19)\n(pushright sokoban l19 l20 l21 crate1)\n(pushright sokoban l20 l21 l22 crate1)\n(pushright sokoban l21 l22 l23 crate1)\n(pushright sokoban l22 l23 l24 crate1)\n(moveup sokoban l23 l14)\n(moveright sokoban l14 l15)\n(pushdown sokoban l15 l24 l33 crate1)\n(pushdown sokoban l24 l33 l42 crate1)\n(pushdown sokoban l33 l42 l51 crate1)\n(pushleft sokoban l42 l41 l40 crate2)\n(moveright sokoban l41 l42)\n(moveright sokoban l42 l43)\n(movedown sokoban l43 l52)\n(movedown sokoban l52 l61)\n(moveleft sokoban l61 l60)\n(pushup sokoban l60 l51 l42 crate1)\n(moveright sokoban l51 l52)\n(moveup sokoban l52 l43)\n(pushleft sokoban l43 l42 l41 crate1)",
      "prompt_actions": {
        "Prompt 2": "moveright sokoban l11 l12",
        "Prompt 3": "pushleft sokoban l43 l42 l41 crate1",
        "Prompt 4a": "moveup sokoban l21 l12",
        "Prompt 4b": "moveleft sokoban l42 l43",
        "Prompt 4c-1": "pushdown sokoban l15 l24 l33 crate1",
        "Prompt 4c-2": "pushup sokoban l33 l24 l15 crate2",
        "Prompt 5": "pushright sokoban l37 l38 l39 crate1"
      }
    }
  ]
}